1212;mandioca yuca 1kg;1x4500;2500;;1kg-yuka-mandioca;;20
111;prueba 111;1x5000;4500;;prueba;;15
2121;lector de codigos de barra;1x300000;240000;;electronicos-comerciales;;6
7790036046327;vino en carton uvita tinto 1lt;1x9000;7000;;1lt-vino tinto-argentino-uvita;;10
7790036046327;vino tinto en carton uvita 1lt;1x10000;8000;;1lt-bebida alcoholica-vino tinto;;24
7613035494800;leche modificada en polvo nestle nido fortigrow 800g;1x37000;34000;;800g-leche en polvo-nido;;2
7894321711478;toddy original em polvo 800g;1x22000y2x41000;19000;;800g-chocolate en polvo-toddy-brasil;;5
